Q3.1_1,Q3.1_2,Q3.1_3,Q3.1_4,Q3.1_5,Q3.1_6,Q3.1_7,Q3.1_8,Q3.1_9,Q3.1_10,Q3.1_11,Q3.1_12,Q3.1_13,Q3.1_14,Q3.1_15,Q3.1_16,Q3.1_17,Q3.1_18,Q3.1_19,Q3.1_20,Q3.1_21,Q3.1_22,Q3.1_23,Q3.1_24,Q3.1_24_TEXT,Q3.2,Q3.2_1_TEXT,Q3.3,Q3.4,Q3.5,Q3.6_1,Q3.6_2,Q3.6_3,Q3.6_4,Q3.6_5,Q3.6_6,Q3.6_7,Q3.6_7_TEXT,Q3.7_1,Q3.7_2,Q3.7_3,Q3.7_4,Q3.7_5,Q3.7_6,Q4.1,Q4.2,Q5.1_1,Q5.1_2,Q5.1_3,Q5.1_4,Q5.1_5,Q5.1_6,Q5.1_7,Q5.1_8,Q5.1_9,Q5.1_10,Q5.1_11,Q5.1_12,Q5.1_13,Q5.1_14,Q5.1_15,Q5.1_16,Q5.1_17,Q5.1_18,Q5.1_18_TEXT,Q5.2,Q6.1,Q6.1_1_TEXT,Q6.2,Q6.2_5_TEXT,Q6.3,Q6.4,Q6.5,Q6.6,Q6.7,Q6.8,Q6.9,Q6.10,Q6.11,Q6.12,Q7.1,Q7.2,Q7.3,Q7.4,Q7.5_1,Q7.5_2,Q7.5_3,Q7.5_4,Q7.6,Q7.7,Q7.8,Q7.9,Q8.1,Q8.2,Q8.3,Q8.4,Q8.4_4_TEXT,Q8.5,Q8.6,Q9.1,Q9.2,Q9.3,Q9.3_4_TEXT,Q9.4,Q9.5,Q9.6,Q9.7,Q10.1,Q10.2,Q10.3,Q10.4,Q11.1,Q11.2,Q11.3,Q11.4,Q11.4_4_TEXT,Q11.5,Q12.1,Q12.1_5_TEXT,Q12.2,Q12.2_6_TEXT,Q12.3,Q12.3_4_TEXT,Q12.4,Q13.1,Q13.2,Q13.3,Q13.3_8_TEXT,Q13.4,Q13.4_9_TEXT,Q13.5,Q13.5_6_TEXT,Q13.6,Q13.6_5_TEXT,Q14.1,PROLIFIC_PID
How comfortable are you sharing the following types of personal information online? - Name,How comfortable are you sharing the following types of personal information online? - Address,How comfortable are you sharing the following types of personal information online? - Location,How comfortable are you sharing the following types of personal information online? - Phone Number,How comfortable are you sharing the following types of personal information online? - Financial Information,How comfortable are you sharing the following types of personal information online? - Health Information,How comfortable are you sharing the following types of personal information online? - Social Security Number,How comfortable are you sharing the following types of personal information online? - Password,How comfortable are you sharing the following types of personal information online? - Browsing Data,How comfortable are you sharing the following types of personal information online? - Audio or Video Recordings,How comfortable are you sharing the following types of personal information online? - Demographic Information,How comfortable are you sharing the following types of personal information online? - Physical Characteristics,How comfortable are you sharing the following types of personal information online? - Email,How comfortable are you sharing the following types of personal information online? - IP Address,How comfortable are you sharing the following types of personal information online? - Identification Information,How comfortable are you sharing the following types of personal information online? - Biometric Information,How comfortable are you sharing the following types of personal information online? - Employment Information,How comfortable are you sharing the following types of personal information online? - Geolocation data,How comfortable are you sharing the following types of personal information online? - Cookies,How comfortable are you sharing the following types of personal information online? - Sexual Orientation,How comfortable are you sharing the following types of personal information online? - Religious Belief,How comfortable are you sharing the following types of personal information online? - Income,How comfortable are you sharing the following types of personal information online? - Content of communication,How comfortable are you sharing the following types of personal information online? - Others,How comfortable are you sharing the following types of personal information online? - Others - Text,"Are there any types of personal information that you would never share online, regardless of the circumstances? - Selected Choice","Are there any types of personal information that you would never share online, regardless of the circumstances? - Yes (Please name them) - Text",How comfortable are you with the security of your personal data when using your smartphone for financial transactions?,Do you regularly use fitness trackers or health apps?,How often do you share your health data collected by fitness trackers or health apps with others?,How comfortable are you with sharing your health data with the following types of organizations? - Third party Companies,How comfortable are you with sharing your health data with the following types of organizations? - Government agencies,How comfortable are you with sharing your health data with the following types of organizations? - Fitness app developers,How comfortable are you with sharing your health data with the following types of organizations? - Healthcare Providers,How comfortable are you with sharing your health data with the following types of organizations? - Health insurance Companies,How comfortable are you with sharing your health data with the following types of organizations? - Research institutions,How comfortable are you with sharing your health data with the following types of organizations? - Other (Please Specify),How comfortable are you with sharing your health data with the following types of organizations? - Other (Please Specify) - Text,To what extent do the following factors influence your comfort level with sharing location data with apps? - Benefits of Sharing,To what extent do the following factors influence your comfort level with sharing location data with apps? - Trust in Applications,To what extent do the following factors influence your comfort level with sharing location data with apps? - Privacy Concerns,To what extent do the following factors influence your comfort level with sharing location data with apps? - Security Measures,To what extent do the following factors influence your comfort level with sharing location data with apps? - Government Surveillance,To what extent do the following factors influence your comfort level with sharing location data with apps? - Social Norms,"How much do you agree with the following statement?

'Cultural values and norms in my country influence how people view online privacy'.",Please explain how cultural values are influencing your view on online privacy.,How important are the following values to you when it comes to online privacy? - Indivisualism (e.g. Independence),How important are the following values to you when it comes to online privacy? - Collectivism (e.g. Community influence),How important are the following values to you when it comes to online privacy? - Power Distance (e.g. Income inequality),How important are the following values to you when it comes to online privacy? - Uncertainty Avoidance (e.g. How well you handle the unknown),How important are the following values to you when it comes to online privacy? - Masculinity (e.g. Focus on achieving goals),How important are the following values to you when it comes to online privacy? - Femininity (e.g. Focus on building relations),How important are the following values to you when it comes to online privacy? - Long-term Orientation (e.g. Future focused),How important are the following values to you when it comes to online privacy? - Short-term Orientation (e.g. Present focused),How important are the following values to you when it comes to online privacy? - Trust (e.g.. Do you trust the app),How important are the following values to you when it comes to online privacy? - Control (e.g. How much control do you want companies to have over your data),How important are the following values to you when it comes to online privacy? - Security (e.g.. How protected do you want your information to be),How important are the following values to you when it comes to online privacy? - Ethics,How important are the following values to you when it comes to online privacy? - Group (e.g. Do you use apps more if people you know use it),How important are the following values to you when it comes to online privacy? - Family Values (e.g. Importance of family relationships),How important are the following values to you when it comes to online privacy? - Religious Beliefs (e.g.Religious teachings influencing behaivor),How important are the following values to you when it comes to online privacy? - Media and news outlets(e.g. Influence local media has),How important are the following values to you when it comes to online privacy? - Educational Backgrounds (e.g. Level and type of education influencing understanding of privacy),How important are the following values to you when it comes to online privacy? - Others (please specify),How important are the following values to you when it comes to online privacy? - Others (please specify) - Text,How do these values influence your decisions about sharing personal information online? Please provide specific examples to illustrate your point.,"Have you lived in a country that is culturally different from your own (e.g., moving from an Eastern country to a Western country or vice versa) for more than six months? - Selected Choice","Have you lived in a country that is culturally different from your own (e.g., moving from an Eastern country to a Western country or vice versa) for more than six months? - Yes (Please list the country/countries you have lived in) - Text","Did you move from an Eastern country to a Western country, or from a Western country to an Eastern country? Alternatively, did you move between countries within the Eastern region or within the Western region? Please Specify. - Selected Choice","Did you move from an Eastern country to a Western country, or from a Western country to an Eastern country? Alternatively, did you move between countries within the Eastern region or within the Western region? Please Specify. - Others (Please Specify) - Text","After I moved, I care more about my online privacy after interacting with people from different cultures.",Please explain in what ways did these interactions influence your online privacy concerns.,I care more about my online privacy after living in a Western country.,I care more about my online privacy after living in an Eastern country.,I became more privacy-conscious after interacting with people from other cultures.,Please describe how living in a Western country has changed your online privacy practices.,Please describe how living in an eastern country has changed your online privacy practices.,Please provide specific examples of how your privacy practices have changed.,"For quality assurance, please select ""Somewhat Comfortable"" for this item.",I share less personal information online after interacting with people from different cultures.,How much influence does your cultural background and personal values have on your trust in social media platforms regarding privacy?,Can you provide specific examples of how your cultural background and personal values have influenced your trust in social media platforms regarding privacy?,How much influence does your technological literacy have on your trust in social media platforms regarding privacy?,Can you provide specific examples of how your technological literacy has influenced your trust in social media platforms regarding privacy?,Have you ever felt pressured by any of the following cultural norms to share more personal information than you were comfortable with online? (Select all that apply) - Family Expectation,Have you ever felt pressured by any of the following cultural norms to share more personal information than you were comfortable with online? (Select all that apply) - Peer Pressure,Have you ever felt pressured by any of the following cultural norms to share more personal information than you were comfortable with online? (Select all that apply) - Social Media Trends,Have you ever felt pressured by any of the following cultural norms to share more personal information than you were comfortable with online? (Select all that apply) - Cultural Values,"If 'Other', please specify.",Please describe how it made you feel.,"To what extent do cultural norms (e.g., family expectations, social norms) influence how often you adjust your online privacy settings?","Do you trust the privacy policies of platforms popular in your home country compared to global platforms (e.g., Facebook, Instagram, Twitter, TikTok, Google, etc)?",Have you ever read a privacy policy of an application prior to use?,How often do you read privacy policies for apps?,Do you read privacy notices shown prior to using an app?,'I accept the privacy notices for an app without reading them'. - Selected Choice,'I accept the privacy notices for an app without reading them'. - Others (Please specify) - Text,Are you familiar with privacy labels that provide information about an app's privacy practices?,How often do you review privacy labels before using a new application or service?,Do you regularly check and adjust the privacy settings of the applications and services you use?,"If you know that an application or service has experienced a data breach in the past, are you likely to continue using it?","Consider two apps with similar features: App A requires full access to your photos but is free, while App B allows you to choose which photos to share but requires a fee. Which app are you more likely to use? - Selected Choice","Consider two apps with similar features: App A requires full access to your photos but is free, while App B allows you to choose which photos to share but requires a fee. Which app are you more likely to use? - Other (Please Specify) - Text",Why did you choose App A?,Which pricing option would you prefer?,Why did you choose App B?,How important is it to you to have control over which photos you share with apps?,"Consider you downloaded an app, and it asks you to give access to your location. Which option do you choose?","Consider you downloaded an app, and it asks you to give access to your photos. Which option do you choose?","Consider you downloaded an app, and it asks you to give access to your microphone. Which option do you choose?","Consider you downloaded an app, and it asks you to give access to your camera. Which option do you choose?",How familiar are you with privacy regulations in your country?,Please name the major privacy regulation(s) in your country.,Do you support the idea of government regulations to protect online privacy?,Which of the following types of legal requirements do you think are most important? (Select all that apply) - Selected Choice,Which of the following types of legal requirements do you think are most important? (Select all that apply) - Others (Please specify) - Text,What are your main concerns about government involvement in privacy protection?,Which types of devices do you use regularly? - Selected Choice,Which types of devices do you use regularly? - Others (Please specify) - Text,Which of the following social media platforms do you use most frequently? - Selected Choice,Which of the following social media platforms do you use most frequently? - Other (Please Specify) - Text,"Do you feel more comfortable using social media platforms that are popular in your country versus global platforms (e.g., Facebook, Instagram, Twitter, TikTok, WhatsApp, Messenger, Telegram, etc)? - Selected Choice","Do you feel more comfortable using social media platforms that are popular in your country versus global platforms (e.g., Facebook, Instagram, Twitter, TikTok, WhatsApp, Messenger, Telegram, etc)? - Other (Please Specify) - Text","How frequently do you use privacy-focused web browsers (e.g., Brave, Tor, Duck Duck Go, etc)?",What is your age?,What is your gender?,What is your highest level of education? - Selected Choice,What is your highest level of education? - Others (Please Specify) - Text,"If you have obtained a degree, which fields did you study? (Select all that apply) - Selected Choice","If you have obtained a degree, which fields did you study? (Select all that apply) - Other (please specify). - Text",What is your religious affliation? - Selected Choice,What is your religious affliation? - Others (Please Specify) - Text,How Important is religion in your daily life? - Selected Choice,How Important is religion in your daily life? - Others (Please Specify) - Text,Any other feedback or comments?,PROLIFIC_PID
Somewhat Comfortable,Somewhat Uncomfortable,Extremely Uncomfortable,Extremely Uncomfortable,Extremely Uncomfortable,Extremely Uncomfortable,Extremely Uncomfortable,Extremely Uncomfortable,Somewhat Comfortable,Extremely Uncomfortable,Neutral,Somewhat Uncomfortable,Somewhat Comfortable,Somewhat Uncomfortable,Extremely Uncomfortable,Extremely Uncomfortable,Somewhat Comfortable,Extremely Uncomfortable,Somewhat Uncomfortable,Somewhat Uncomfortable,Extremely Comfortable,Extremely Uncomfortable,Somewhat Uncomfortable,,,Yes (Please name them),bank information; exact location,Somewhat Comfortable,Yes,Never,Extremely Uncomfortable,Neutral,Neutral,Extremely Comfortable,Extremely Uncomfortable,Extremely Comfortable,,,Greatly Decrease Comfort,Greatly Decrease Comfort,Greatly Decrease Comfort,Somewhat Increase Comfort,Somewhat Decrease Comfort,Greatly Decrease Comfort,Agree,"Some cultures are more open in sharing information while others are more closed off and cold making people keep their privacy more. My culture is a very warm and welcoming culture and I feel like we, as a whole, don't have issues with sharing information unless it's highly sensitive or highly private information.",Extremely Important,Moderately Important,Slightly Important,Slightly Important,Slightly Important,Moderately Important,Moderately Important,Slightly Important,Extremely Important,Not at all Important,Extremely Important,Extremely Important,Very Important,Slightly Important,Not at all Important,Very Important,Very Important,,,"If a website or app has very solid and open ethical values I would feel more inclined to trust them with my information. On the other hand, if a website or app are heavily influenced by highly prohibiting values like religious values I wouldn't feel like I could trust them with my information because these people usually lack individualism and who knows who they'd share my information with if asked to do so.",No,,,,Neutral,,Neutral,Neutral,Agree,,,"Hearing other people's bad experiences has made me more aware of what I do and share online to avoid falling into the same things those people fell into. I don't accept cookies anymore, I always read the tiny disclaimers before agreeing to anything, I make sure to google who I'm giving my information to and try to evaluate how trustworthy they are.",Somewhat Comfortable,Agree,Moderate Influence,,Moderate Influence,,No,No,Maybe,No,,,Rarely,Slightly Trusting,Yes,If I am not in a rush,Sometimes,Sometimes,,"Yes, Somewhat Familiar",Sometimes,"Yes, Sometimes","No, Rarely","App B (Paid, selective photo sharing)",,,Yearly Subscription ($29.99),"Even though it's paid, it's best to be safe than sorry and try to keep my personal information as protected as possible",Very Important,Deny,Deny,Deny,Deny,Not Very Familiar,,Strongly Support,All of the Above,,,Smartphone,,TikTok,,The global platforms are the ones that are popular in my country.,,Never,25-34,Female,High School,,,,None,,Not Important,,,61170774ac0279df55dd786e
Somewhat Comfortable,Somewhat Uncomfortable,Somewhat Uncomfortable,Somewhat Uncomfortable,Extremely Uncomfortable,Somewhat Uncomfortable,Extremely Uncomfortable,Extremely Uncomfortable,Extremely Uncomfortable,Neutral,Neutral,Neutral,Neutral,Extremely Uncomfortable,Somewhat Uncomfortable,Extremely Uncomfortable,Somewhat Uncomfortable,Somewhat Uncomfortable,Somewhat Uncomfortable,Neutral,Neutral,Somewhat Uncomfortable,Neutral,Neutral,,No,,Somewhat Uncomfortable,Yes,Rarely,Somewhat Uncomfortable,Somewhat Comfortable,Neutral,Extremely Comfortable,Neutral,Somewhat Comfortable,Neutral,,No Influence,Somewhat Increase Comfort,Somewhat Decrease Comfort,No Influence,Somewhat Decrease Comfort,Somewhat Decrease Comfort,Disagree,,Moderately Important,Very Important,Very Important,Very Important,Not at all Important,Not at all Important,Moderately Important,Moderately Important,Very Important,Very Important,Extremely Important,Extremely Important,Very Important,Very Important,Moderately Important,Very Important,Moderately Important,Moderately Important,,"Well, I try to avoid sharing personal data with unknown, or untrustworthy agents. (Shady data miner companies, suspicious websites, etc.)
I try to avoid sharing photos of people on social media without their permission.
I set my social media posts accordingly to type (only for friends - public)
I use online credit card which I only open during payment and I freeze it after.
Honestly, I don't trust that my data is safe on the Internet. ",Yes (Please list the country/countries you have lived in),Portugal,East to West,,Neutral,,Neutral,Neutral,Neutral,,,,Somewhat Comfortable,Neutral,Minimal Influence,,Significant Influence,"For example I used to open which third parties have access to my data when I accept cookies. It's quite terrifying that sometimes this number is in the 1500's and many of these companies have shady names and unknown. I used to read articles and tips in regards of safety. I am not a professional, but I try to have a balance as it seems the Internet become almost useless if I try to avoid sharing data. Honestly it's quite concerning especially that digitalisation is taking over every aspect of our life meanwhile data breeches, data collections are everyday issue, and basically there is not any useful protection against them, not in hardwares and softwares, not in laws. ",Maybe,Yes,Yes,Maybe,,Anxious,Sometimes,Not at all,Yes,Only if I have concerns about the app,Rarely,Sometimes,,"No, Not Familiar At All",,"No, Rarely","Yes, Sometimes",Neither,,,,,,Allow only while using the app,Ask every time,Ask every time,Ask every time,Not Very Familiar,,Strongly Support,"Notifying Users About Data Breaches,Limits on Data Retention,Rights to Transfer Personal Data,Limits on Data Colection,Limit on sharing with third parties,Limit on sharing with other apps and agencies,All of the Above",,,Tablet,,Facebook,,The global platforms are the ones that are popular in my country.,,Rarely,35-44,Male,High School,,Other (please specify).,Environmental Engineering,Christianity,,Not Important,,,660c66c664e1b8cf2bb25749
